"description","qid","item","wiki_name","name","label"
"avant-garde art movement in the early 20th century","Q6034","http://www.wikidata.org/entity/Q6034","Dada","Dada","2"
"religious movements within Korean shamanism","Q5208236","http://www.wikidata.org/entity/Q5208236","Daejongism","Daejonggyo","1"
"building","Q521453","http://www.wikidata.org/entity/Q521453","Dælenenga idrettspark","Dælenenga idrettspark","1"
"railway station in Switzerland","Q15964122","http://www.wikidata.org/entity/Q15964122","Dagmersellen railway station","Dagmersellen railway station","1"
"Austrian architect and artist (1887-1923)","Q87024","http://www.wikidata.org/entity/Q87024","Dagobert Peche","Dagobert Peche","1"
"former state religion of Dahomey","Q716356","http://www.wikidata.org/entity/Q716356","Dahomean religion","Dahomean religion","1"
"1971 film directed by Morris and René Goscinny","Q543486","http://www.wikidata.org/entity/Q543486","Daisy Town (film)","Daisy Town","2"
"Senegalese art movement (1960–1974)","Q3577793","http://www.wikidata.org/entity/Q3577793","Dakar School","Dakar School","2"
"1945-1952 business and art venue in California, USA","Q5210982","http://www.wikidata.org/entity/Q5210982","Daliel's Bookstore","daliel's Gallery","1"
"transport company","Q380660","http://www.wikidata.org/entity/Q380660","Dallas Area Rapid Transit","Dallas Area Rapid Transit","1"
"French philatelic editor","Q501440","http://www.wikidata.org/entity/Q501440","Dallay","Dallay","1"
"barrier that impounds water or underground streams","Q12323","http://www.wikidata.org/entity/Q12323","Dam","dam","0"
"French food dish","Q22976","http://www.wikidata.org/entity/Q22976","Dampfnudel","Dampfnudel","1"
"American self help writer","Q1159127","http://www.wikidata.org/entity/Q1159127","Dan Millman","Dan Millman","2"
"a kind of specialized undergarment commonly worn by male ballet dancers","Q2778381","http://www.wikidata.org/entity/Q2778381","Dance belt","dance belt","0"
"team of participants in competitive dance","Q5215303","http://www.wikidata.org/entity/Q5215303","Dance squad","dance squad","0"
"competitive ballroom dancing","Q738622","http://www.wikidata.org/entity/Q738622","Dancesport","dancesport","0"
"novel","Q85755629","http://www.wikidata.org/entity/Q85755629","Daniel Airlie","Daniel Airlie","1"
"Nobel Prize-winning medical researcher","Q108576","http://www.wikidata.org/entity/Q108576","Daniel Carleton Gajdusek","Daniel Carleton Gajdusek","0"
"New Zealand equestrian","Q1161248","http://www.wikidata.org/entity/Q1161248","Daniel Jocelyn","Daniel Jocelyn","1"
"Argentine politician","Q1162679","http://www.wikidata.org/entity/Q1162679","Daniel Scioli","Daniel Scioli","1"
"Czech football player and manager","Q669313","http://www.wikidata.org/entity/Q669313","Daniel Šmejkal","Daniel Šmejkal","1"
"British mathematician, essayist and autistic savant","Q12857","http://www.wikidata.org/entity/Q12857","Daniel Tammet","Daniel Tammet","2"
"Mayor of Ghent","Q12500","http://www.wikidata.org/entity/Q12500","Daniël Termont","Daniël Termont","1"
"American actor, comedian, director and producer","Q26806","http://www.wikidata.org/entity/Q26806","Danny DeVito","Danny DeVito","2"
"type of band playing dansband music","Q1164847","http://www.wikidata.org/entity/Q1164847","Dansband","dansband","1"
"art movement","Q587691","http://www.wikidata.org/entity/Q587691","Danube school","Danube school","2"
"Museum in Doncaster, United Kingdom","Q5295507","http://www.wikidata.org/entity/Q5295507","Doncaster Museum and Art Gallery","Danum Gallery, Library and Museum","1"
"type of structure attached to a mosque","Q5221946","http://www.wikidata.org/entity/Q5221946","Dar al-Muwaqqit","Dar al-Muwaqqit","1"
"1998 non-fiction book by Mark Mazower","Q85755715","http://www.wikidata.org/entity/Q85755715","Dark Continent: Europe's Twentieth Century","Dark Continent: Europe's Twentieth Century","1"
"romanticism sub-genre","Q1418745","http://www.wikidata.org/entity/Q1418745","Dark Romanticism","dark romanticism","2"
"bookshop in London, England","Q5223445","http://www.wikidata.org/entity/Q5223445","Dark They Were and Golden Eyed (bookshop)","Dark They Were, and Golden-Eyed","1"
"capital city of the Northern Territory, Australia, and the surrounding area","Q11568","http://www.wikidata.org/entity/Q11568","Darwin, Northern Territory","Darwin","1"
"German magazine, 1833-","Q1170050","http://www.wikidata.org/entity/Q1170050","Das Pfennig-Magazin","Das Pfennig-Magazin","1"
"class of soup and cooking stock used in Japanese cuisines","Q851746","http://www.wikidata.org/entity/Q851746","Dashi","dashi","2"
"public authority that monitor and supervise, through investigative and corrective powers, the application of the data protection law","Q3242920","http://www.wikidata.org/entity/Q3242920","National data protection authority","data protection authority","0"
"property right, protecting the investment made in compiling a database","Q688416","http://www.wikidata.org/entity/Q688416","Database right","database right","0"
"belief in knowledge","Q31273854","http://www.wikidata.org/entity/Q31273854","Dataism","dataism","0"
"American actor and former professional wrestler","Q44158","http://www.wikidata.org/entity/Q44158","Dave Bautista","Dave Bautista","2"
"British broadcaster and naturalist (born 1926)","Q183337","http://www.wikidata.org/entity/Q183337","David Attenborough","David Attenborough","2"
"British politician (born 1966)","Q192","http://www.wikidata.org/entity/Q192","David Cameron","David Cameron","2"
"English athlete, sports official, and Conservative Party politician (1905-1981)","Q1628","http://www.wikidata.org/entity/Q1628","David Cecil, 6th Marquess of Exeter","David Cecil, 6th Marquess of Exeter","1"
"German historian and theologian","Q65468","http://www.wikidata.org/entity/Q65468","David Chytraeus","David Chytraeus","1"
"American filmmaker, visual artist, musician, and actor (1946–2025)","Q2071","http://www.wikidata.org/entity/Q2071","David Lynch","David Lynch","2"
"Japanese animation studio","Q3018644","http://www.wikidata.org/entity/Q3018644","David Production","David Production","2"
"Croatian writer and musician","Q14715","http://www.wikidata.org/entity/Q14715","Davor Slamnig","Davor Slamnig","1"
"Christian observance that commemorates the execution of the male children in Bethlehem as told in Matthew 2:16","Q154005","http://www.wikidata.org/entity/Q154005","Day of the Holy Innocents","Day of the Holy Innocents","1"
"type of religious organisation","Q107434367","http://www.wikidata.org/entity/Q107434367","Denomination (religion)","de-nominalist church","1"
"structure used for the temporary storage of a human corpse before burial or transportation, usually located within or near a cemetery","Q5245481","http://www.wikidata.org/entity/Q5245481","Dead house","dead house","0"
"carrying, free of charge, a transport company's own staff on a normal passenger trip","Q177982","http://www.wikidata.org/entity/Q177982","Deadheading (employee)","Deadheading","0"
"major international sport event for deaf people","Q498635","http://www.wikidata.org/entity/Q498635","Deaflympics","Deaflympics","0"
"social and philosophical movement that encourages people to speak openly about death, dying, and corpses","Q55639561","http://www.wikidata.org/entity/Q55639561","Death-positive movement","Death-positive movement","0"
"film festival in Deauville, Normandy, France","Q3070448","http://www.wikidata.org/entity/Q3070448","Deauville Asian Film Festival","Deauville Asian Film Festival","1"
"type of dance","Q3042309","http://www.wikidata.org/entity/Q3042309","Debaa","Debaa","1"
"Feathery edge at the border of a sheet of hand- or mold-made paper","Q152159","http://www.wikidata.org/entity/Q152159","Deckle edge","Deckle-edge","1"
"laminated composite material primarily used as a finish for furniture and wall panels","Q5249625","http://www.wikidata.org/entity/Q5249625","Decorative laminate","decorative laminate","0"
"Alevitic religious leader","Q1182135","http://www.wikidata.org/entity/Q1182135","Dede (religious figure)","Dedes","1"
"ecological and environmental philosophy","Q216279","http://www.wikidata.org/entity/Q216279","Deep ecology","deep ecology","0"
"government agency","Q749381","http://www.wikidata.org/entity/Q749381","Defense Threat Reduction Agency","Defense Threat Reduction Agency","1"
"German record label","Q266180","http://www.wikidata.org/entity/Q266180","Defiance Records","Defiance Records","1"
"annual music festival held in the Netherlands and Australia","Q582456","http://www.wikidata.org/entity/Q582456","Defqon.1 Festival","Defqon.1 Festival","1"
"music festival","Q1183120","http://www.wikidata.org/entity/Q1183120","Deichbrand","Deichbrand","1"
"belief in God without revelation","Q620629","http://www.wikidata.org/entity/Q620629","Deism","deism","0"
"transport company","Q682863","http://www.wikidata.org/entity/Q682863","DELAG","DELAG","2"
"museum in Wilmington, Delaware","Q5253245","http://www.wikidata.org/entity/Q5253245","The Delaware Contemporary","Delaware Center for the Contemporary Arts","1"
"Office that represents the Government of Catalonia around the world","Q19713851","http://www.wikidata.org/entity/Q19713851","Delegation of the Government abroad (Catalonia)","Delegation of the Government abroad (Catalonia)","1"
"food item that is considered highly desirable in certain cultures","Q2312129","http://www.wikidata.org/entity/Q2312129","Delicacy","delicacy","2"
"2006 film by Tom DiCillo","Q4471","http://www.wikidata.org/entity/Q4471","Delirious (2006 film)","Delirious","0"
"politician or orator who panders to fears and emotions of the public","Q10264925","http://www.wikidata.org/entity/Q10264925","Demagogue","demagogue","0"
"administrative unit in ancient Athens","Q672490","http://www.wikidata.org/entity/Q672490","Deme","deme","1"
"fish that live on, in, or near the bottom of the body of salt- (cod, flounder, halibut, sole...) or fresh-water they inhabit","Q2734949","http://www.wikidata.org/entity/Q2734949","Demersal fish","demersal","0"
"Hungarian priest (?–1592)","Q5255191","http://www.wikidata.org/entity/Q5255191","Demeter Hunyadi","Demeter Hunyadi","1"
"237Wizzy Based in Cameroon","Q17151372","http://www.wikidata.org/entity/Q17151372","Demigodz","DEMI GODZ","1"
"American actress and producer (born 1962)","Q43044","http://www.wikidata.org/entity/Q43044","Demi Moore","Demi Moore","2"
"social democratic political party in Lithuania","Q63755","http://www.wikidata.org/entity/Q63755","Democratic Labour Party of Lithuania","Democratic Labour Party of Lithuania","1"
"Member parties of Chinese United Front except Chinese Communist Party.","Q66451430","http://www.wikidata.org/entity/Q66451430","Democratic parties (China)","Democratic parties of China","1"
"Greek philosopher (c. 460–c. 370 BC)","Q41980","http://www.wikidata.org/entity/Q41980","Democritus","Democritus","2"
"manhwa","Q562734","http://www.wikidata.org/entity/Q562734","Demon Diary","Demon Diary","2"
"magazine from Japan","Q31326","http://www.wikidata.org/entity/Q31326","Dengeki Maoh","Dengeki Maoh","1"
"sturdy cotton or cotton-blend twill textile","Q652698","http://www.wikidata.org/entity/Q652698","Denim","denim","2"
"French Enlightenment philosopher writer and encyclopædist (1713–1784)","Q448","http://www.wikidata.org/entity/Q448","Denis Diderot","Denis Diderot","2"
"revivalist movement within Sunni Islam","Q2366025","http://www.wikidata.org/entity/Q2366025","Deobandi movement","Deobandi","2"
"a type of government agency, found in many jurisdictions, responsible for managing prisons and parole/probation services","Q5260216","http://www.wikidata.org/entity/Q5260216","Department of Corrections","department of corrections","0"
"governmental organization that overseas public parks and recreational public works","Q5260434","http://www.wikidata.org/entity/Q5260434","Department of Parks and Recreation","department of parks and recreation","0"
"initiation ritual at European universities from the Middle Ages until the 18th century","Q474456","http://www.wikidata.org/entity/Q474456","Deposition (university)","Deposition","1"
"building","Q507134","http://www.wikidata.org/entity/Q507134","Dépôt des marbres","Dépôt des marbres","1"
"Government office in New South Wales, Australia","Q111193712","http://www.wikidata.org/entity/Q111193712","Deputy Leader of the Government in the Legislative Council (New South Wales)","Deputy Leader of the Government in the Legislative Council","1"
"second-in-command of a political party","Q5261098","http://www.wikidata.org/entity/Q5261098","Deputy leader","deputy party leader","0"
"second highest-ranking member of the Senate of Nigeria","Q18206482","http://www.wikidata.org/entity/Q18206482","Deputy President of the Nigerian Senate","Deputy President of the Nigerian Senate","1"
"tributary of the Illinois River","Q8637","http://www.wikidata.org/entity/Q8637","Des Plaines River","Des Plaines River","1"
"musical term with several meanings","Q577996","http://www.wikidata.org/entity/Q577996","Descant","descant","0"
"person who designs","Q5322166","http://www.wikidata.org/entity/Q5322166","Designer","designer","0"
"British actor (1914-1999)","Q29092","http://www.wikidata.org/entity/Q29092","Desmond Llewelyn","Desmond Llewelyn","2"
"topless female performer covered in body paint who poses for photos in exchange for tips in the pedestrian plaza of New York City's Time Square","Q48344369","http://www.wikidata.org/entity/Q48344369","Desnuda","desnuda","0"
"painting that inspires travel","Q106071447","http://www.wikidata.org/entity/Q106071447","Destination painting","destination painting","0"
"philosophy of avoiding unnecessary pain influenced by Stoic and Buddhist schools","Q3045261","http://www.wikidata.org/entity/Q3045261","Nonattachment (philosophy)","detachment","0"
"German-American biologist","Q109599","http://www.wikidata.org/entity/Q109599","Detlef Weigel","Detlef Weigel","1"
"German classical music record label","Q168407","http://www.wikidata.org/entity/Q168407","Deutsche Grammophon","Deutsche Grammophon","2"
"state postal company in the German Democratic Republic","Q316296","http://www.wikidata.org/entity/Q316296","Deutsche Post of the GDR","Deutsche Post of the GDR","1"
"German literary award for children's and young adult literature (1956-)","Q691086","http://www.wikidata.org/entity/Q691086","Deutscher Jugendliteraturpreis","Deutscher Jugendliteraturpreis","1"
"programs designed to improve the political, economic and social situation in developing countries","Q865909","http://www.wikidata.org/entity/Q865909","Development aid","development aid","0"
"egg-based dish","Q551458","http://www.wikidata.org/entity/Q551458","Deviled egg","deviled egg","0"
"Japanese manga series","Q97275377","http://www.wikidata.org/entity/Q97275377","Devilish Darlings Portal Fantasy","Devilish Darlings Portal Fantasy","2"
"1972 Japanese manga by Go Nagai","Q2632547","http://www.wikidata.org/entity/Q2632547","Devilman","Devilman","2"
"cloth paintings depicting Devnarayan","Q5267626","http://www.wikidata.org/entity/Q5267626","Devnarayan Ki Phad","Devnarayan Ki Phad","1"
"poetry by Haldhar Nag","Q124645451","http://www.wikidata.org/entity/Q124645451","Dhado Bargachh","Dhado Bargachh","1"
"Nepali folk dance","Q13182447","http://www.wikidata.org/entity/Q13182447","Dhan Nach","Dhan Nach","1"
"important day in the independence of Brazil","Q24403","http://www.wikidata.org/entity/Q24403","Dia do Fico","Dia do Fico","1"
"philosophical underpinnings of social ecology, exploring the interrelationship between social problems and their consequences on the ecological impact of human society","Q5270538","http://www.wikidata.org/entity/Q5270538","Dialectical naturalism","dialectical naturalism","0"
"German actress and children's writer","Q66027","http://www.wikidata.org/entity/Q66027","Diana Amft","Diana Amft","1"
"building layout in ancient architecture","Q5272160","http://www.wikidata.org/entity/Q5272160","Diaulos (architecture)","diaulos","1"
"artist (1928-1980)","Q267992","http://www.wikidata.org/entity/Q267992","Dick Dillin","Dick Dillin","1"
"philosophy","Q2502127","http://www.wikidata.org/entity/Q2502127","Didacticism","didacticism","0"
"combined coal and oil power plant and natural-gas power plant in Oxfordshire, England, UK","Q3298465","http://www.wikidata.org/entity/Q3298465","Didcot power stations","Didcot power stations","1"
"emperor of ancient Rome (193 CE)","Q1440","http://www.wikidata.org/entity/Q1440","Didius Julianus","Didius Julianus","1"
"German bimonthly magazine specialized on chess compositions","Q541144","http://www.wikidata.org/entity/Q541144","Die Schwalbe","Die Schwalbe","1"
"Japanese manga series","Q120336550","http://www.wikidata.org/entity/Q120336550","Die Wergelder","Die Wergelder","2"
"Spanish painter (1599-1660)","Q297","http://www.wikidata.org/entity/Q297","Diego Velázquez","Diego Velázquez","2"
"German geneticist and evolutionary biologist","Q108624","http://www.wikidata.org/entity/Q108624","Diethard Tautz","Diethard Tautz","1"
"German Catholic philosopher and theologian (1889–1977)","Q14678","http://www.wikidata.org/entity/Q14678","Dietrich von Hildebrand","Dietrich von Hildebrand","2"
"comic released digitally","Q4505975","http://www.wikidata.org/entity/Q4505975","Digital comic","digital comic","0"
"form of electronic literature","Q919982","http://www.wikidata.org/entity/Q919982","Digital poetry","digital poetry","0"
"Policies relating to digital domains","Q119070334","http://www.wikidata.org/entity/Q119070334","Digital policy","digital policy","0"
"Turkish dessert","Q6017615","http://www.wikidata.org/entity/Q6017615","Dilber dudağı","Dilber dudağı","2"
"Russian pop singer","Q42904","http://www.wikidata.org/entity/Q42904","Dima Bilan","Dima Bilan","2"
"19th-c. centers for the working class","Q5277223","http://www.wikidata.org/entity/Q5277223","Dime museum","dime museum","1"
"syncretic religion propounded by Mughal emperor Akbar in 1582","Q2347558","http://www.wikidata.org/entity/Q2347558","Din-i Ilahi","Din-e Ilahi","1"
"Italian automotive brand manufacturing","Q577775","http://www.wikidata.org/entity/Q577775","Dino (marque)","Dino","2"
"office of the chancellor of a diocese","Q18245463","http://www.wikidata.org/entity/Q18245463","Diocesan chancery","diocesan chancery","0"
"3rd-century Roman biographer of Greek philosophers","Q59138","http://www.wikidata.org/entity/Q59138","Diogenes Laertius","Diogenes Laërtius","2"
"2nd-century Greek Epicurean philosopher","Q59137","http://www.wikidata.org/entity/Q59137","Diogenes of Oenoanda","Diogenes of Oenoanda","2"
"4th-century BC Greek Cynic philosopher","Q59180","http://www.wikidata.org/entity/Q59180","Diogenes","Diogenes of Sinope","2"
"ritual of ancient Greece and Rome","Q696284","http://www.wikidata.org/entity/Q696284","Dionysian Mysteries","Dionysian Mysteries","2"
"Festival in Scarperia, Italy","Q3708591","http://www.wikidata.org/entity/Q3708591","Diotto","Diotto","1"
"group of people from one state present in another state to represent the sending state","Q213283","http://www.wikidata.org/entity/Q213283","Diplomatic mission","diplomatic mission","0"
"frame-by-frame variant form of stop motion graphic animation techniques","Q5280355","http://www.wikidata.org/entity/Q5280355","Direct manipulation animation","Direct manipulation animation","0"
"director of a creative work","Q3455803","http://www.wikidata.org/entity/Q3455803","Director (creative work)","director","0"
"structure of the Scottish Government civil service","Q16829741","http://www.wikidata.org/entity/Q16829741","Directorates of the Scottish Government","Directorates of the Scottish Government","1"
"service that maps the names of network resources to their respective network addresses","Q756230","http://www.wikidata.org/entity/Q756230","Directory service","directory service","0"
"traditional dress worn in Germany, Switzerland, Liechtenstein, Austria and South Tyrol","Q73603","http://www.wikidata.org/entity/Q73603","Dirndl","dirndl","2"
"religion and subsequent philosophy based on the veneration or worship of Eris","Q7340","http://www.wikidata.org/entity/Q7340","Discordianism","Discordianism","1"
"US youth-targeted television channel owned by the Walt Disney Company","Q178837","http://www.wikidata.org/entity/Q178837","Disney Channel","Disney Channel","2"
"1990-1993 comic book publishing imprint","Q742886","http://www.wikidata.org/entity/Q742886","Disney Comics (publishing)","Disney Comics","2"
"comics featuring Walt Disney characters","Q906229","http://www.wikidata.org/entity/Q906229","Disney comics","Disney comics","2"
"international group of television channels for preschool aged children","Q123018834","http://www.wikidata.org/entity/Q123018834","Disney Jr. (programming block)","Disney Jr.","2"
"seizure of property to obtain payments","Q186302","http://www.wikidata.org/entity/Q186302","Distraint","distraint","0"
"Canadian music distributor","Q478685","http://www.wikidata.org/entity/Q478685","Distribution Select","Distribution Select","1"
"administrative unit within the capital of Hungary","Q851110","http://www.wikidata.org/entity/Q851110","List of districts in Budapest","district of Budapest","1"
"American heavy metal band","Q131366","http://www.wikidata.org/entity/Q131366","Disturbed (band)","Disturbed","2"
"situation where different parties/coalitions are in control of different organs of government","Q28130222","http://www.wikidata.org/entity/Q28130222","Divided government","divided government","0"
"tower from which to jump or dive into water","Q579772","http://www.wikidata.org/entity/Q579772","Diving platform","diving platform","0"
"historical event separating North and South Korea","Q498735","http://www.wikidata.org/entity/Q498735","Division of Korea","division of Korea","1"
"Persian phrase to describe a guest house or room","Q5284735","http://www.wikidata.org/entity/Q5284735","Diwan-khane","diwan-khane","1"
"sports club","Q169802","http://www.wikidata.org/entity/Q169802","DJK Agon 08 Düsseldorf","DJK Agon 08 Düsseldorf","1"
"Russian media personality","Q15253","http://www.wikidata.org/entity/Q15253","Dmitry Puchkov","Dmitry Puchkov","1"
"policy of the British East India Company, in force until 1858, that British India will annex any Indian princely state under British suzerainty if its ruler was “incompetent” (according to British judgment) or died without a male heir","Q1233944","http://www.wikidata.org/entity/Q1233944","Doctrine of lapse","doctrine of lapse","1"
"nonfictional motion picture","Q93204","http://www.wikidata.org/entity/Q93204","Documentary film","documentary film","0"
"type of sport where dogs participate","Q38936","http://www.wikidata.org/entity/Q38936","List of dog sports","dog sport","0"
"Japanese animation studio","Q3033729","http://www.wikidata.org/entity/Q3033729","Doga Kobo","Doga Kobo","2"
"Japanese term for self-published works, usually magazines, manga or novels","Q668711","http://www.wikidata.org/entity/Q668711","Doujinshi","dōjinshi","2"
"Manga series and 2016 anime movie","Q19691705","http://www.wikidata.org/entity/Q19691705","Classmates (manga)","Dōkyūsei","2"
"Playboy Playmate, actress","Q123865","http://www.wikidata.org/entity/Q123865","Dolly Martin","Dolly Martin","2"
"man-made marine structure","Q8157","http://www.wikidata.org/entity/Q8157","Dolphin (structure)","dolphin","0"
"lamp design used on the Thames Embankment, London","Q19872684","http://www.wikidata.org/entity/Q19872684","Dolphin lamp standard","Dolphin lamp standard","1"
"building in Unlocated","Q5289711","http://www.wikidata.org/entity/Q5289711","Dom-Ino House","Dom-ino House","0"
"mountain in the Mont Blanc massif in the Alps","Q30434","http://www.wikidata.org/entity/Q30434","Dôme du Goûter","Dôme du Goûter","0"
"food-preparing domestic worker","Q2276446","http://www.wikidata.org/entity/Q2276446","Cook (domestic worker)","domestic worker cook","0"
"animal that has been tamed and that lives with humans","Q622852","http://www.wikidata.org/entity/Q622852","Domesticated animal","domesticated animal","0"
"soft white salty cheese made primarily in Egypt","Q5290273","http://www.wikidata.org/entity/Q5290273","Domiati","Domiati","1"
"continuous dominance of a single political party in elections","Q2439061","http://www.wikidata.org/entity/Q2439061","Dominant-party system","dominant-party system","0"
"2005 film directed by Tony Scott","Q32910","http://www.wikidata.org/entity/Q32910","Domino (2005 film)","Domino","0"
"building in Pisa, Italy","Q3035643","http://www.wikidata.org/entity/Q3035643","Domus Galilaeana","Domus Galilaeana","1"
"1967 film by Alberto Lattuada","Q46477","http://www.wikidata.org/entity/Q46477","Don Juan in Sicily","Don Giovanni in Sicilia","1"
"1993-2010 policy on gay people serving in the US military","Q135475","http://www.wikidata.org/entity/Q135475","Don't ask, don't tell","don't ask, don't tell","1"
"American sociologist (1945-)","Q5294651","http://www.wikidata.org/entity/Q5294651","Donald Kraybill","Donald Kraybill","1"
"music festival","Q1240909","http://www.wikidata.org/entity/Q1240909","Donaufestival","Donaufestival","1"
"music festival","Q1240934","http://www.wikidata.org/entity/Q1240934","Donauinselfest","Donauinselfest","1"
"Shopping mall in Vienna, Austria","Q450465","http://www.wikidata.org/entity/Q450465","Donau Zentrum","Donauzentrum","1"
"English rugby league football club","Q3036242","http://www.wikidata.org/entity/Q3036242","Doncaster R.L.F.C.","Doncaster RLFC","1"
"Korean neo-Confucian movement","Q904958","http://www.wikidata.org/entity/Q904958","Donghak","Donghak","1"
"1190 poetic composition by Raimbaut de Vaqueiras","Q25688755","http://www.wikidata.org/entity/Q25688755","Domna, tant vos ai preiada","Donna, tant vos ai preiada","1"
"2004 film by Tsutomu Shibayama","Q1074386","http://www.wikidata.org/entity/Q1074386","Doraemon: Nobita in the Wan-Nyan Spacetime Odyssey","Doraemon: Nobita in the Wan-Nyan Spacetime Odyssey","2"
