"description","qid","item","wiki_name","name","label"
"Christian movements (e.g. Waldensians, Lollards, Hussites) seen as precursors to the Protestant Reformation","Q56292614","http://www.wikidata.org/entity/Q56292614","Proto-Protestantism","Proto-Protestantism","2"
"subdivision of Belgium","Q83116","http://www.wikidata.org/entity/Q83116","Provinces of Belgium","province of Belgium","1"
"province of Italy","Q15129","http://www.wikidata.org/entity/Q15129","Province of Foggia","Province of Foggia","1"
"administrative body of Southern Ireland from January–December 1922","Q450799","http://www.wikidata.org/entity/Q450799","Provisional Government of Ireland (1922)","Provisional Government of Southern Ireland","1"
"provisional government (1918)","Q2528166","http://www.wikidata.org/entity/Q2528166","Provisional Siberian Government (Vladivostok)","Provisional Siberian Government","1"
"historical films made in Germany during the Weimar and Nazi eras, glorifying Prussian history and military, set during the 18th–19th centuries, particularly focusing on Frederick the Great; approx. 44 were produced","Q1456178","http://www.wikidata.org/entity/Q1456178","Prussian film","Prussian film","1"
"library in Germany","Q860581","http://www.wikidata.org/entity/Q860581","Prussian Heritage Image Archive","Prussian Heritage Image Archive","1"
"conception of reason and action","Q7255479","http://www.wikidata.org/entity/Q7255479","Pseudorationalism","Pseudorationalism","0"
"subgenre of horror film","Q7256286","http://www.wikidata.org/entity/Q7256286","Psycho-biddy","psycho-biddy","2"
"philosophical discussions in pubs","Q7257244","http://www.wikidata.org/entity/Q7257244","Pub Philosophy","Pub Philosophy","2"
"buildings or groups of buildings owned and operated by a governing body, carrying out official duties, and often occupied by a governmental agency","Q294422","http://www.wikidata.org/entity/Q294422","Public building","public building","0"
"historian who fosters the general public's engagement with history","Q7257753","http://www.wikidata.org/entity/Q7257753","Public historian","public historian","0"
"legal practices undertaken to help poor or marginalized people","Q18345563","http://www.wikidata.org/entity/Q18345563","Public interest law","public interest law","0"
"branch of law involving relationships between individuals and the state, or the functioning of the state itself","Q207892","http://www.wikidata.org/entity/Q207892","Public law","public law","0"
"UK, paying authors for books borrowed from libraries","Q449962","http://www.wikidata.org/entity/Q449962","Public Lending Right","Public Lending Right","1"
"Engagement of philosophy in public venues","Q17143572","http://www.wikidata.org/entity/Q17143572","Public philosophy","public philosophy","0"
"principled guide to action taken by the administrative executive branches of the state with regard to a class of issues","Q546113","http://www.wikidata.org/entity/Q546113","Public policy","public policy","0"
"Greek state-owned electricity company","Q326345","http://www.wikidata.org/entity/Q326345","Public Power Corporation","Public Power Corporation SA","1"
"type of government organization","Q11775750","http://www.wikidata.org/entity/Q11775750","Parquet (legal)","public prosecutor's office","0"
"toilet and washroom for anyone to use","Q813966","http://www.wikidata.org/entity/Q813966","Public toilet","public toilet","0"
"Spanish and South American stew","Q2633627","http://www.wikidata.org/entity/Q2633627","Puchero","Puchero","2"
"dessert or savory dish","Q9053","http://www.wikidata.org/entity/Q9053","Pudding","pudding","0"
"consolidated municipality and capital of the Colombian department of Vichada","Q130304","http://www.wikidata.org/entity/Q130304","Puerto Carreño","Puerto Carreño","1"
"American internet television service","Q85794996","http://www.wikidata.org/entity/Q85794996","Puffer (research study)","Puffer","2"
"New Zealand film and television production company","Q7259111","http://www.wikidata.org/entity/Q7259111","Pūkeko Pictures","Pūkeko Pictures","1"
"city in the Rhein-Erft-Kreis, North Rhine-Westphalia, Germany","Q4113","http://www.wikidata.org/entity/Q4113","Pulheim","Pulheim","1"
"American award for distinguished works of fiction, since 1948","Q833633","http://www.wikidata.org/entity/Q833633","Pulitzer Prize for Fiction","Pulitzer Prize for Fiction","2"
"fisheries management technique","Q18345710","http://www.wikidata.org/entity/Q18345710","Pulse fishing","Pulse fishing","0"
"type of German rye bread","Q837207","http://www.wikidata.org/entity/Q837207","Pumpernickel","pumpernickel","2"
"traditional British puppet show","Q2250832","http://www.wikidata.org/entity/Q2250832","Punch and Judy","Punch and Judy","2"
"Ancient Indian kingdom","Q3350794","http://www.wikidata.org/entity/Q3350794","Pundravardhana","Pundravardhana","1"
"Indian sport","Q18639277","http://www.wikidata.org/entity/Q18639277","Punjabi kabaddi","Punjabi Kabaddi","2"
"person who makes dolls and puppets, mostly by hand","Q2217284","http://www.wikidata.org/entity/Q2217284","Puppet designer","puppet designer","0"
"animation technique","Q2118696","http://www.wikidata.org/entity/Q2118696","Puppetoon animation","puppetoon animation","2"
"form of theatre or performance that involves the manipulation of puppets","Q588750","http://www.wikidata.org/entity/Q588750","Puppetry","puppetry","0"
"Hindu ritual","Q13113395","http://www.wikidata.org/entity/Q13113395","Pushpanjali","Pushpanjali","1"
"term for a volcanic hill in Auvergne, France","Q1297565","http://www.wikidata.org/entity/Q1297565","Puy","Puy","1"
"clothing made from pvc fabric","Q6547537","http://www.wikidata.org/entity/Q6547537","PVC clothing","PVC clothing","0"
"catholic cathedral in Helsinki, Finland","Q31204","http://www.wikidata.org/entity/Q31204","St. Henry's Cathedral","Pyhän Henrikin katedraali","1"
"Russian composer (1840–1893)","Q7315","http://www.wikidata.org/entity/Q7315","Pyotr Ilyich Tchaikovsky","Pyotr Ilyich Tchaikovsky","2"
"species of plant","Q146281","http://www.wikidata.org/entity/Q146281","Pyrus communis","Pyrus communis","0"
"British music magazine","Q217629","http://www.wikidata.org/entity/Q217629","Q (magazine)","Q","2"
"Flemish writer","Q14063","http://www.wikidata.org/entity/Q14063","Herman Brusselmans","Q14063","1"
"olive plant, species of plant used as food","Q37083","http://www.wikidata.org/entity/Q37083","Olive","Q37083","0"
"Italian comics artist and illustrator","Q511692","http://www.wikidata.org/entity/Q511692","Igort","Q511692","2"
"German engineer, racing driver and F1 circuit designer","Q57759","http://www.wikidata.org/entity/Q57759","Hermann Tilke","Q57759","2"
"law established by sovereigns in Islamic countries","Q17014705","http://www.wikidata.org/entity/Q17014705","Qanun (law)","Qanun","2"
"television channel","Q65173787","http://www.wikidata.org/entity/Q65173787","Qaraqalpaqstan (TV channel)","Qaraqalpaqstan","1"
"poetry of Qing dynasty","Q7267789","http://www.wikidata.org/entity/Q7267789","Qing poetry","Qing poetry","1"
"traditional Manchu clothing","Q106617043","http://www.wikidata.org/entity/Q106617043","Qizhuang","Qizhuang","1"
"government of Palestine, from Feb 2005","Q3111841","http://www.wikidata.org/entity/Q3111841","Third Qurei Government","Qoreï Cabinet","1"
"a document developed by management to express the directive of the top management with respect to quality","Q9061582","http://www.wikidata.org/entity/Q9061582","Quality policy","quality policy","0"
"territorial subdivision of certain Italian towns","Q5571369","http://www.wikidata.org/entity/Q5571369","Quartiere","quarter of a city in Italy","1"
"administrative division of Luxembourg City, Luxembourg","Q3394564","http://www.wikidata.org/entity/Q3394564","Quarters of Luxembourg City","quarter of Luxembourg City","1"
"ceremonial gate tower in traditional Chinese architecture","Q823101","http://www.wikidata.org/entity/Q823101","Que (tower)","Que","2"
"music genre and type of dance","Q3413969","http://www.wikidata.org/entity/Q3413969","Quebradita","Quebradita","1"
"art museum in Brisbane, Queensland, Australia","Q7270900","http://www.wikidata.org/entity/Q7270900","Queensland Art Gallery","Queensland Art Gallery","1"
"former Australian literary awards 1999-2012","Q7270981","http://www.wikidata.org/entity/Q7270981","Queensland Premier's Literary Awards","Queensland Premier's Literary Awards","1"
"type of dance","Q526878","http://www.wikidata.org/entity/Q526878","Queer Tango","Queer Tango","2"
"gesture","Q15455610","http://www.wikidata.org/entity/Q15455610","Quenelle (gesture)","quenelle","0"
"American filmmaker","Q3772","http://www.wikidata.org/entity/Q3772","Quentin Tarantino","Quentin Tarantino","2"
"Mexican dish consisting of a tortilla filled with cheese and then grilled","Q865325","http://www.wikidata.org/entity/Q865325","Quesadilla","quesadilla","2"
"designer furniture label","Q7272548","http://www.wikidata.org/entity/Q7272548","Quinze & Milan","Quinze & Milan","2"
"governing body of The Church of Jesus Christ of Latter-Day Saints","Q1779357","http://www.wikidata.org/entity/Q1779357","Quorum of the Twelve Apostles (LDS Church)","Quorum of the Twelve Apostles","2"
"Superleague Fórmula","Q2971871","http://www.wikidata.org/entity/Q2971871","R.S.C. Anderlecht (Superleague Formula team)","R.S.C. Anderlecht","2"
"Sikh music tradition","Q15620963","http://www.wikidata.org/entity/Q15620963","Rababi","Rababi","1"
"Television production company","Q3415889","http://www.wikidata.org/entity/Q3415889","Rabbit Ears Productions","Rabbit Ears Productions","0"
"Hand gesture","Q15130677","http://www.wikidata.org/entity/Q15130677","Rabia sign","Rabia sign","1"
"film genre","Q2125170","http://www.wikidata.org/entity/Q2125170","Race film","race film","1"
"French actress and theatre director","Q275346","http://www.wikidata.org/entity/Q275346","Rachida Brakni","Rachida Brakni","1"
"sports equipment","Q240502","http://www.wikidata.org/entity/Q240502","Racket (sports equipment)","racket","0"
"Polish sweet dish","Q2125335","http://www.wikidata.org/entity/Q2125335","Racuchy","racuchy","1"
"building material that reflects thermal radiation and reduces heat transfer","Q7280316","http://www.wikidata.org/entity/Q7280316","Radiant barrier","radiant barrier","0"
"Wikimedia disambiguation page","Q7280470","http://www.wikidata.org/entity/Q7280470","Radical Traditionalism","Radical Traditionalism","0"
"English rock band","Q44190","http://www.wikidata.org/entity/Q44190","Radiohead","Radiohead","2"
"Japanese animation studio","Q3543920","http://www.wikidata.org/entity/Q3543920","Radix Ace Entertainment","Radix","2"
"surface or underground structure designed to house a water wheel in order to drive a flatrod system","Q2126732","http://www.wikidata.org/entity/Q2126732","Radstube","Radstube","1"
"form of Indian miniature painting","Q7282803","http://www.wikidata.org/entity/Q7282803","Ragamala paintings","Ragamala painting","2"
"lake in Kautokeino, Norway","Q1775570","http://www.wikidata.org/entity/Q1775570","Rágesjávri","Rágesjávri","1"
"Sikh musician who plays hymns in different ragas","Q15621011","http://www.wikidata.org/entity/Q15621011","Ragi (Sikhism)","ragi","1"
"type of rail transport","Q2234623","http://www.wikidata.org/entity/Q2234623","Rail freight transport","rail freight transport","0"
"conveyance of passengers and goods by way of wheeled vehicles running on rail tracks","Q3565868","http://www.wikidata.org/entity/Q3565868","Rail transport","rail transport","0"
"entity that operates a railroad track and/or trains","Q249556","http://www.wikidata.org/entity/Q249556","Rail transport company","railway company","0"
"railway facility where trains regularly stop to load or unload passengers and/or freight","Q55488","http://www.wikidata.org/entity/Q55488","Train station","railway station","0"
"film festival","Q3070178","http://www.wikidata.org/entity/Q3070178","Raindance Film Festival","Raindance Film Festival","2"
"German film director, screenwriter, film producer and writer (1933–2023)","Q62574","http://www.wikidata.org/entity/Q62574","Rainer Erler","Rainer Erler","1"
"Canadian computer animation company","Q3299128","http://www.wikidata.org/entity/Q3299128","Mainframe Studios","Rainmaker Entertainment","2"
"weather modification ritual","Q477738","http://www.wikidata.org/entity/Q477738","Rainmaking (ritual)","rainmaking rites","0"
"gesture used to raise attention","Q60741394","http://www.wikidata.org/entity/Q60741394","Raising hands","raising hands","0"
"one of the four major yogic paths of Hinduism","Q2128768","http://www.wikidata.org/entity/Q2128768","Rāja yoga","Rāja yoga","2"
"UK record label; imprint of RAK Records Ltd.","Q478062","http://www.wikidata.org/entity/Q478062","Rak Records","RAK","2"
"German singer","Q66691","http://www.wikidata.org/entity/Q66691","Ralf Scheepers","Ralf Scheepers","1"
"English composer (1872-1958)","Q207947","http://www.wikidata.org/entity/Q207947","Ralph Vaughan Williams","Ralph Vaughan Williams","2"
"name for individual stems in a clonal colony","Q123740152","http://www.wikidata.org/entity/Q123740152","Ramet","ramet","0"
"technique for constructing foundations, floors, and walls by compacting a damp mixture of sub soil","Q1363009","http://www.wikidata.org/entity/Q1363009","Rammed earth","rammed earth","0"
"American general-interest trade book publisher","Q744182","http://www.wikidata.org/entity/Q744182","Random House","Random House","2"
"cryptology tool","Q7291983","http://www.wikidata.org/entity/Q7291983","Random number book","random number book","0"
"species of plant","Q6100344","http://www.wikidata.org/entity/Q6100344","Ranunculus bullatus","Ranunculus bullatus","0"
"artist who speaks rhymes in a rhythm over music","Q2252262","http://www.wikidata.org/entity/Q2252262","Rapper","rapper","0"
"artistic form of vocal delivery and emotive expression that incorporates ""rhyme, rhythmic speech, and [commonly] street vernacular""","Q6010","http://www.wikidata.org/entity/Q6010","Rapping","rapping","2"
"ecclesiastical architectural style that flourished in the Serbian Middle Ages","Q1756718","http://www.wikidata.org/entity/Q1756718","Raška architectural school","Rascian architecture","1"
"mountain of the Glarus Alps","Q16537","http://www.wikidata.org/entity/Q16537","Rautispitz","Rautispitz","1"
"German company specializing in games, toys, books and puzzles","Q697136","http://www.wikidata.org/entity/Q697136","Ravensburger","Ravensburger","2"
"Student pilot deported from New Zealand for having 9/11 hijacker links","Q7298434","http://www.wikidata.org/entity/Q7298434","Rayed Mohammed Abdullah Ali","Rayed Mohammed Abdullah Ali","0"
"actor, film director (1904-1981)","Q282588","http://www.wikidata.org/entity/Q282588","Raymond Rouleau","Raymond Rouleau","1"
"British independent record label","Q3421539","http://www.wikidata.org/entity/Q3421539","Reaction Records","Reaction","1"
"service that arranges one-time shared rides on very short notice","Q27973","http://www.wikidata.org/entity/Q27973","Ridesharing company","real-time ridesharing","0"
"royal palace in Seville, Spain","Q498261","http://www.wikidata.org/entity/Q498261","Alcázar of Seville","Reales Alcázares","2"
"film genre","Q7301269","http://www.wikidata.org/entity/Q7301269","Reality film","reality film","0"
"1942 adventure color film made in USA","Q31971","http://www.wikidata.org/entity/Q31971","Reap the Wild Wind","Reap the Wild Wind","2"
"German visual artist (1944–2024)","Q442192","http://www.wikidata.org/entity/Q442192","Rebecca Horn","Rebecca Horn","2"
"open resistance against the orders of an established authority that seeks to gain concessions from an oppressive power","Q124734","http://www.wikidata.org/entity/Q124734","Rebellion","rebellion","0"
"period in the history of the Iberian Peninsula","Q79791","http://www.wikidata.org/entity/Q79791","Reconquista","Reconquista","1"
"business producing and selling music","Q2442401","http://www.wikidata.org/entity/Q2442401","Record company","record company","0"
"person, musician who performs music for recordings","Q55960555","http://www.wikidata.org/entity/Q55960555","Recording artist","recording artist","0"
"Red Bull's GP2 series racing team","Q2079949","http://www.wikidata.org/entity/Q2079949","Red Bull Junior Team","Red Bull Junior Team","0"
"mixed martial arts academy in St. Petersburg, Russia","Q2033662","http://www.wikidata.org/entity/Q2033662","Red Devil Sport Club","Red Devil Sport Club","1"
"anti-communist, anti-leftist political movement in Japan after World War II","Q1571843","http://www.wikidata.org/entity/Q1571843","Red Purge","Red Purge","1"
"commercial name of fish of Sparidae family","Q2013906","http://www.wikidata.org/entity/Q2013906","Red seabream","red seabream","0"
"1971 film by Terence Young","Q32790","http://www.wikidata.org/entity/Q32790","Red Sun","Red Sun","0"
"chocolate cake","Q1284887","http://www.wikidata.org/entity/Q1284887","Red velvet cake","red velvet cake","2"
"an urban area with a high concentration of sex-related businesses","Q272888","http://www.wikidata.org/entity/Q272888","Red-light district","red-light district","0"
"process of changing the face value of banknotes or coins used in circulating currency","Q13167710","http://www.wikidata.org/entity/Q13167710","Redenomination","redenomination","0"
"new construction on a site that has preexisting uses","Q1441983","http://www.wikidata.org/entity/Q1441983","Redevelopment","redevelopment","0"
"publisher","Q488669","http://www.wikidata.org/entity/Q488669","Reed Business Information","Reed Business Information","0"
"American actress (born 1976)","Q44063","http://www.wikidata.org/entity/Q44063","Reese Witherspoon","Reese Witherspoon","2"
"publication to which one can refer for confirmed facts","Q13136","http://www.wikidata.org/entity/Q13136","Reference work","reference work","0"
"school of epistemology, that beliefs, specifically belief in God, not need to be inferred from other truths to be rationally warranted","Q7307549","http://www.wikidata.org/entity/Q7307549","Reformed epistemology","Reformed epistemology","2"
"Dutch political party","Q60172","http://www.wikidata.org/entity/Q60172","Reformed Political Party","Reformed Political Party","1"
"international law which deals with the rights and duties states have vis-a-vis refugees","Q3039753","http://www.wikidata.org/entity/Q3039753","Refugee law","refugee law","0"
"closed publishing imprint of HarperCollins","Q284739","http://www.wikidata.org/entity/Q284739","ReganBooks","ReganBooks","1"
"painting by Claude Monet, 1867","Q734082","http://www.wikidata.org/entity/Q734082","Regatta at Sainte-Adresse (Monet)","Regatta at Sainte-Adresse","2"
"administrative division of the Philippines","Q24698","http://www.wikidata.org/entity/Q24698","Regions of the Philippines","region of the Philippines","1"
"government of a Peruvian Region","Q3824815","http://www.wikidata.org/entity/Q3824815","Regional governments of Peru","regional government of Peru","1"
"defunct political parties in Belarus","Q70738","http://www.wikidata.org/entity/Q70738","Regional Party of Lithuania and White Ruthenia","Regional Party of Lithuania and White Ruthenia","1"
"city outside the core of a metropolitan area","Q2138558","http://www.wikidata.org/entity/Q2138558","Regiopolis","regiopolis","0"
"Government body of Nazi Germany that handled food","Q315009","http://www.wikidata.org/entity/Q315009","Reichsnährstand","Reichsnährstand","1"
"German-language author, biographer, publicist, and publisher","Q107774","http://www.wikidata.org/entity/Q107774","Reiner Stach","Reiner Stach","2"
"German businessperson","Q122125","http://www.wikidata.org/entity/Q122125","Reinhard Pöllath","Reinhard Pöllath","1"
"Danish biologist","Q63514","http://www.wikidata.org/entity/Q63514","Reinhardt Kristensen","Reinhardt Kristensen","1"
"American film production company (1910–1915)","Q3424328","http://www.wikidata.org/entity/Q3424328","Reliance Film Company","Reliance Motion Picture Corporation","2"
"social-cultural system","Q9174","http://www.wikidata.org/entity/Q9174","Religion","religion","0"
"overview of ancient religious practices in the modern-day Middle East","Q879177","http://www.wikidata.org/entity/Q879177","Religions of the ancient Near East","religions of the ancient Near East","0"
"approach to epistemological questions from a religious perspective","Q7311355","http://www.wikidata.org/entity/Q7311355","Religious epistemology","religious epistemology","0"
"relationship between national identity and religion","Q2019152","http://www.wikidata.org/entity/Q2019152","Religious nationalism","religious nationalism","0"
"philosophical thinking that is inspired and directed by a particular religion","Q2054106","http://www.wikidata.org/entity/Q2054106","Religious philosophy","religious philosophy","2"
"reawakening of the religious consciousness after a period of spiritual dormancy","Q7311395","http://www.wikidata.org/entity/Q7311395","Religious revival","religious revival","0"
"film genre","Q3396019","http://www.wikidata.org/entity/Q3396019","Remodernist film","remodernist film","1"
"French conscription policy","Q17027642","http://www.wikidata.org/entity/Q17027642","Remplacement","Remplacement","1"
"Indonesian spicy meat dish originating from Minangkabau Highlands in West Sumatra","Q1520293","http://www.wikidata.org/entity/Q1520293","Rendang","rendang","2"
"German author and playwright (1962–2024)","Q85625","http://www.wikidata.org/entity/Q85625","René Pollesch","René Pollesch","1"
"American record label","Q645889","http://www.wikidata.org/entity/Q645889","Reprise Records","Reprise Records","2"
"Ancient Roman law","Q3933322","http://www.wikidata.org/entity/Q3933322","Res mancipi","res mancipi","1"
"the second team fielded by a sports club","Q2412834","http://www.wikidata.org/entity/Q2412834","Reserve team","reserve team","0"
"land use in which housing predominates, as opposed to industrial and commercial areas","Q674950","http://www.wikidata.org/entity/Q674950","Residential area","residential area","0"
"administrative territorial entity of the People's Republic of China","Q985488","http://www.wikidata.org/entity/Q985488","Residential community","residential community","1"
"public area, usually adjacent to limited-access highway, used for rest from travel","Q786014","http://www.wikidata.org/entity/Q786014","Rest area","rest area","0"
"sports or games team that competes from the 'rest of the world' as opposed to a single country","Q3427953","http://www.wikidata.org/entity/Q3427953","Rest of the world in sports and games","rest of the world","0"
"Unionist government of Virginia","Q24694","http://www.wikidata.org/entity/Q24694","Restored Government of Virginia","Restored Government of Virginia","1"
"list of plants with the same or similar names","Q7316555","http://www.wikidata.org/entity/Q7316555","Resurrection plant","Resurrection plant","0"
"celebratory dinner","Q17051962","http://www.wikidata.org/entity/Q17051962","Réveillon","Réveillon","2"
"government agency responsible for the intake of government revenue, tax administration in some jurisdiction","Q573607","http://www.wikidata.org/entity/Q573607","Revenue service","revenue service","0"
"type of photographic film that produces a positive image on a transparent base","Q166816","http://www.wikidata.org/entity/Q166816","Reversal film","reversal film","0"
"performer dedicated to reviving a musical or cultural form from an earlier era","Q17078348","http://www.wikidata.org/entity/Q17078348","Revivalist artist","revivalist artist","0"
"tripartite bodies established during Cultural Revolution in China","Q7318739","http://www.wikidata.org/entity/Q7318739","Revolutionary committee (China)","Revolutionary committee","1"
"historical profession","Q936371","http://www.wikidata.org/entity/Q936371","Rhapsode","rhapsode","1"
"river in Western Europe to the North Sea","Q584","http://www.wikidata.org/entity/Q584","Rhine","Rhine","0"
"species of fish","Q10360338","http://www.wikidata.org/entity/Q10360338","Cownose ray","Rhinoptera bonasus","0"
"building in Ohio, United States","Q280656","http://www.wikidata.org/entity/Q280656","Rhodes State Office Tower","Rhodes State Office Tower","1"
"artist (1846-1930)","Q545830","http://www.wikidata.org/entity/Q545830","Riccardo Drigo","Riccardo Drigo","1"
"American historian and philosopher","Q59874","http://www.wikidata.org/entity/Q59874","Richard Carrier","Richard Carrier","2"
"American actor (born 1949)","Q48410","http://www.wikidata.org/entity/Q48410","Richard Gere","Richard Gere","2"
"German zoologist (1850-1937)","Q85907","http://www.wikidata.org/entity/Q85907","Richard Hertwig","Richard Hertwig","1"
"US-American-German painter (1901–1978)","Q126074","http://www.wikidata.org/entity/Q126074","Richard Lindner (painter)","Richard Lindner","2"
"President of the United States from 1969 to 1974","Q9588","http://www.wikidata.org/entity/Q9588","Richard Nixon","Richard Nixon","2"
"German composer (1813–1883)","Q1511","http://www.wikidata.org/entity/Q1511","Richard Wagner","Richard Wagner","2"
"brand of plastic laminate","Q7330715","http://www.wikidata.org/entity/Q7330715","Paper composite panels","Richlite","0"
"Czech Christian festival","Q40270","http://www.wikidata.org/entity/Q40270","Ride of the Kings","Ride of the Kings","1"
"Manufacturer of vans and minibuses under the brand name Latvija","Q81243","http://www.wikidata.org/entity/Q81243","Riga Autobus Factory","Riga Autobus Factory","1"
"right to mint and issue coins","Q352055","http://www.wikidata.org/entity/Q352055","Minting rights","right of coinage","0"
"one of the so-called regalia (also called royal privileges or sovereign rights)","Q356851","http://www.wikidata.org/entity/Q356851","Right of coinage in the Holy Roman Empire","right of coinage in the Holy Roman Empire","1"
"contractual right","Q694719","http://www.wikidata.org/entity/Q694719","Right of first refusal","right of first refusal","0"
